{
  "$schema": "https://json-schema.org/draft/2020-12/schema",
  "$id": "https://raw.githubusercontent.com/langmartai/lm-assist/main/docs/mcp-plugin.schema.json",
  "title": "lm-assist MCP plugin manifest (mcp-plugin.json)",
  "description": "Manifest for a third-party MCP tool plugin loaded by lm-assist. The manifest is parsed WITHOUT executing anything: it is the discovery + human-review surface. See docs/mcp-plugin-contract.md for the full contract.",
  "type": "object",
  "additionalProperties": false,
  "required": ["manifestVersion", "name", "version", "description", "author", "entry", "tools", "checksum"],
  "properties": {
    "$schema": {
      "type": "string",
      "description": "Optional pointer to this schema, for editor completion."
    },
    "manifestVersion": {
      "const": 1,
      "description": "Contract version. Only 1 exists; lm-assist rejects unknown versions rather than guessing."
    },
    "name": {
      "type": "string",
      "pattern": "^[a-z0-9]+(?:[_-][a-z0-9]+)*$",
      "maxLength": 24,
      "description": "Plugin id. MUST equal the plugin directory name. No consecutive separators (so the ext__<plugin>__<tool> namespace stays unambiguous)."
    },
    "version": {
      "type": "string",
      "pattern": "^\\d+\\.\\d+\\.\\d+(?:-[0-9A-Za-z.-]+)?(?:\\+[0-9A-Za-z.-]+)?$",
      "description": "Semantic version of the plugin payload."
    },
    "description": {
      "type": "string",
      "minLength": 1,
      "maxLength": 300,
      "description": "One-line summary shown on the /mcp-tools review screen."
    },
    "author": {
      "type": "string",
      "minLength": 1,
      "maxLength": 120,
      "description": "Human-readable author/owner, e.g. \"Chart Team <chart@example.com>\"."
    },
    "homepage": {
      "type": "string",
      "maxLength": 300,
      "description": "Optional URL for docs/source."
    },
    "entry": {
      "type": "object",
      "additionalProperties": false,
      "required": ["command", "args"],
      "description": "How to spawn the MCP stdio server. Structured on purpose: never a shell string, spawned with shell:false.",
      "properties": {
        "command": {
          "enum": ["node"],
          "description": "Interpreter allow-list. v1 permits only Node (the runtime lm-assist already ships)."
        },
        "args": {
          "type": "array",
          "minItems": 1,
          "maxItems": 16,
          "items": {
            "type": "string",
            "maxLength": 200,
            "pattern": "^(?!.*\\.\\.)(?:--[a-z0-9][a-z0-9-]*(?:=[A-Za-z0-9._:/-]+)?|[A-Za-z0-9._][A-Za-z0-9._/-]*)$",
            "description": "A plugin-relative path or a --flag. No absolute paths, no '..', no shell metacharacters."
          }
        }
      }
    },
    "tools": {
      "type": "array",
      "minItems": 1,
      "maxItems": 64,
      "description": "The tools this plugin advertises. AUTHORITATIVE: lm-assist advertises exactly these, without spawning the plugin. A tool that appears only at runtime is never exposed.",
      "items": { "$ref": "#/$defs/tool" }
    },
    "capabilities": {
      "$ref": "#/$defs/capabilities",
      "description": "Everything the plugin needs. Undeclared access is denied; declarations are also the human-review surface."
    },
    "keepWarm": {
      "type": "boolean",
      "default": false,
      "description": "Request that the subprocess stay resident between calls instead of being stopped when idle. Honoured at lm-assist's discretion."
    },
    "timeoutMs": {
      "type": "integer",
      "minimum": 1000,
      "maximum": 120000,
      "default": 30000,
      "description": "Advisory per-call timeout request. lm-assist clamps to its own hard cap."
    },
    "checksum": {
      "type": "string",
      "pattern": "^sha256:[a-f0-9]{64}$",
      "description": "Payload digest over every file in the plugin directory EXCEPT mcp-plugin.json. See the contract for the exact canonical algorithm. Pinned at enable time; a change auto-reverts the plugin to disabled."
    }
  },
  "$defs": {
    "tool": {
      "type": "object",
      "additionalProperties": false,
      "required": ["name", "description", "inputSchema"],
      "properties": {
        "name": {
          "type": "string",
          "pattern": "^[a-z0-9]+(?:[_-][a-z0-9]+)*$",
          "maxLength": 32,
          "description": "LOCAL tool name, unprefixed. lm-assist exposes it as ext__<plugin>__<name>; the plugin still receives this local name in tools/call."
        },
        "description": {
          "type": "string",
          "minLength": 1,
          "maxLength": 1024,
          "description": "What the tool does — this is what the calling model reads."
        },
        "inputSchema": {
          "type": "object",
          "required": ["type"],
          "properties": {
            "type": { "const": "object" }
          },
          "description": "JSON Schema for the tool arguments. MUST be an object schema (MCP requirement)."
        },
        "annotations": {
          "type": "object",
          "additionalProperties": false,
          "description": "Optional MCP behaviour hints. Advisory only — never a security control.",
          "properties": {
            "title": { "type": "string", "maxLength": 120 },
            "readOnlyHint": { "type": "boolean" },
            "destructiveHint": { "type": "boolean" },
            "idempotentHint": { "type": "boolean" },
            "openWorldHint": { "type": "boolean" }
          }
        }
      }
    },
    "capabilities": {
      "type": "object",
      "additionalProperties": false,
      "properties": {
        "network": {
          "type": "array",
          "maxItems": 32,
          "default": [],
          "items": {
            "type": "string",
            "maxLength": 261,
            "pattern": "^(\\*\\.)?[a-z0-9]([a-z0-9-]*[a-z0-9])?(\\.[a-z0-9]([a-z0-9-]*[a-z0-9])?)*(:[0-9]{1,5})?$",
            "description": "host or *.suffix, optional :port. No scheme, no path. Loopback/private/link-local targets are rejected by the validator."
          }
        },
        "fs": {
          "type": "array",
          "maxItems": 16,
          "default": [],
          "items": {
            "type": "string",
            "maxLength": 300,
            "pattern": "^(?:<pluginDir>|<scratchDir>|/(?!.*\\.\\.)[^:\\u0000]*)(?::(?:ro|rw))?$",
            "description": "<pluginDir>, <scratchDir>, or an absolute path; optional :ro (default) or :rw suffix."
          }
        },
        "env": {
          "type": "array",
          "maxItems": 16,
          "default": [],
          "items": {
            "type": "string",
            "maxLength": 64,
            "pattern": "^[A-Z][A-Z0-9_]*$",
            "description": "Names of environment variables the plugin needs. Values come from the owner-supplied grant store — NEVER inherited from the lm-assist process. Reserved names (LM_*, PATH, HOME, NODE_OPTIONS, LD_PRELOAD, ...) cannot be declared."
          }
        }
      }
    }
  }
}
